{
  "schema_version": "quickdraw.run-manifest.v1",
  "run_id": "r1a-preflight-20260812-win-cpu",
  "run_kind": "dependency_preflight",
  "created_utc": "2026-08-13T02:46:03Z",
  "identity": {
    "condition_id": null,
    "policy_id": null,
    "scenario_set_id": null,
    "episode_count": null
  },
  "git": {
    "commit": "7a6543285d1c800663a211e87e1ec10556ee6ff9",
    "dirty": true
  },
  "software": {
    "unity": {
      "editor_version": "6000.0.57f1",
      "editor_revision": "b7b9860b7bbd",
      "ml_agents_package": {
        "version": "4.0.0",
        "installed": false
      }
    },
    "python": {
      "version": "3.10.12",
      "implementation": "CPython, conda-forge build h4de0772_0_cpython",
      "packages": {
        "mlagents": "1.1.0",
        "mlagents-envs": "1.1.0",
        "torch": "2.2.1+cpu",
        "numpy": "1.23.5",
        "matplotlib": "3.7.5",
        "pytest": "8.3.5",
        "jsonschema": "4.23.0"
      }
    },
    "trainer_plugin": {
      "installed": false,
      "version": null
    }
  },
  "hardware": {
    "os": {
      "name": "Microsoft Windows 11 Home",
      "version": "10.0.26200",
      "build": "26200"
    },
    "cpu": "AMD Ryzen 5 9600X 6-Core Processor",
    "memory_bytes": 33377591296,
    "gpus": [
      {
        "name": "AMD Radeon(TM) Graphics",
        "driver_version": "32.0.21045.1000"
      },
      {
        "name": "AMD Radeon RX 7900 XT",
        "driver_version": "32.0.31035.1003"
      }
    ]
  },
  "contracts": {
    "schema_version": "quickdraw.research-contracts.v1",
    "sha256": "b6777d7a3b45a8134358c5946c9284c37c3414aad85c8e763dbdf0faf9e33523"
  },
  "artifacts": {
    "root": "Artifacts/Experiments",
    "run_relative_path": "_validation/r1a-preflight-20260812-win-cpu"
  },
  "backend": {
    "reference": "cpu",
    "selected": "cpu",
    "accelerator_candidate": "torch-directml",
    "accelerator_status": "deferred",
    "reason": "torch-directml pins torch 2.4.1 and is not compatible with the verified torch 2.2.1 CPU lock."
  },
  "seeds": {
    "policy_initialization": 11001,
    "replay_sampling": 12001,
    "exploration": 13001,
    "scenario": 21001,
    "opponent": 22001,
    "evaluation": 31001,
    "analysis_bootstrap": 41001
  },
  "hashes": {
    "scene": null,
    "configuration": null,
    "policy": null,
    "model": null
  },
  "validation": {
    "dependency_imports": true,
    "pip_check": true,
    "manifest_schema": true,
    "unity_communication": false,
    "notes": [
      "R1A verifies dependencies and contracts only.",
      "The Unity package is intentionally not installed until a separately approved task."
    ]
  }
}
